{
  "schema_version": 1,
  "id": "warehouse_logistics",
  "title": "Warehousing & Logistics",
  "curriculum_revision": "professional-v2-foundation02-held-six-r01",
  "theme_id": "professional_warehouse_logistics",
  "vocabulary_target": 500,
  "expression_target": 100,
  "modules": [
    {
      "id": "module01",
      "title": "People, schedules, and workplace communication",
      "requirements_revision": "professional-v2-foundation02-held-six-r01",
      "status": "draft",
      "foundation": true,
      "vocabulary_target": 50,
      "expression_target": 10,
      "objectives": [
        "Introduce colleagues, understand schedules, and exchange everyday workplace information."
      ],
      "lexeme_ids": [
        "colleague.workmate.n",
        "employee.worker.n",
        "employer.hiring-organization.n",
        "supervisor.work-overseer.n",
        "manager.work-leader.n",
        "team.working-group.n",
        "department.organization-section.n",
        "customer.buyer.n",
        "client.service-customer.n",
        "visitor.temporary-guest.n",
        "contractor.contracted-worker.n",
        "trainee.learner-worker.n",
        "receptionist.front-desk-worker.n",
        "coordinator.organizer.n",
        "contact.helpful-person.n",
        "supplier.goods-provider.n",
        "schedule.time-plan.n",
        "shift.work-period.n",
        "appointment.arranged-meeting.n",
        "meeting.work-discussion.n",
        "deadline.final-time.n",
        "break.work-pause.n",
        "overtime.additional-work-time.n",
        "attendance.presence-record.n",
        "availability.free-time.n",
        "calendar.date-organizer.n",
        "agenda.meeting-plan.n",
        "invitation.attendance-request.n",
        "update.current-information.n",
        "reminder.memory-prompt.n",
        "announcement.public-message.n",
        "message.communication.n",
        "email.electronic-message.n",
        "phone-call.telephone-conversation.n",
        "voicemail.recorded-message.n",
        "extension.internal-phone-number.n",
        "introduction.first-acquaintance.n",
        "greeting.welcome-message.n",
        "conversation.spoken-exchange.n",
        "discussion.consideration-talk.n",
        "feedback.response-information.n",
        "permission.authorized-consent.n",
        "responsibility.assigned-duty.n",
        "task.work-item.n",
        "role.work-function.n",
        "priority.relative-importance.n",
        "location.place.n",
        "address.postal-location.n",
        "signature.written-name.n",
        "time-zone.regional-time.n"
      ],
      "expression_ids": [
        "expr.foundation.module01.01",
        "expr.foundation.module01.02",
        "expr.foundation.module01.03",
        "expr.foundation.module01.04",
        "expr.foundation.module01.05",
        "expr.foundation.module01.06",
        "expr.foundation.module01.07",
        "expr.foundation.module01.08",
        "expr.foundation.module01.09",
        "expr.foundation.module01.10"
      ],
      "lexeme_files": [
        "res://data/professional/lexemes/foundation-module01.json"
      ],
      "expression_files": [
        "res://data/professional/expressions/foundation-module01.json"
      ]
    },
    {
      "id": "module02",
      "title": "Requests, instructions, and problem reporting",
      "requirements_revision": "professional-v2-foundation02-held-six-r01",
      "status": "draft",
      "foundation": true,
      "vocabulary_target": 50,
      "expression_target": 10,
      "objectives": [
        "Make clear requests, understand instructions, and describe a problem."
      ],
      "lexeme_ids": [
        "request.asking-action.n",
        "instruction.direction.n",
        "clarification.clearer-explanation.n",
        "question.information-request.n",
        "answer.response.n",
        "repeat.say-again.v",
        "explain.make-clear.v",
        "confirm.verify-arrangement.v",
        "check.examine.v",
        "follow.act-on.v",
        "complete.finish.v",
        "prepare.make-ready.v",
        "arrange.organize.v",
        "collect.bring-together.v",
        "deliver.take-to-recipient.v",
        "replace.put-instead.v",
        "return.send-back.v",
        "report.give-information.v",
        "inform.give-information.v",
        "contact.communicate-with.v",
        "correct.put-right.v",
        "adjust.change-slightly.v",
        "reschedule.change-time.v",
        "postpone.delay-until-later.v",
        "cancel.stop-arrangement.v",
        "resolve.solve-problem.v",
        "assist.help.v",
        "ensure.make-certain.v",
        "locate.find-position.v",
        "attach.add-to-message.v",
        "submit.send-for-consideration.v",
        "approve.authorize.v",
        "reject.decline-acceptance.v",
        "sign.write-name.v",
        "delay.late-occurrence.n",
        "error.mistake.n",
        "fault.equipment-defect.n",
        "damage.physical-harm.n",
        "shortage.insufficient-supply.n",
        "missing.not-present.adj",
        "broken.not-working.adj",
        "urgent.needing-prompt-attention.adj",
        "unclear.not-understandable.adj",
        "safe.free-from-unacceptable-danger.adj",
        "unsafe.presenting-danger.adj",
        "hazard.possible-harm.n",
        "incident.workplace-event.n",
        "concern.worrying-matter.n",
        "solution.problem-answer.n",
        "procedure.agreed-method.n"
      ],
      "expression_ids": [
        "expr.foundation.module02.01",
        "expr.foundation.module02.02",
        "expr.foundation.module02.03",
        "expr.foundation.module02.04",
        "expr.foundation.module02.05",
        "expr.foundation.module02.06",
        "expr.foundation.module02.07",
        "expr.foundation.module02.08",
        "expr.foundation.module02.09",
        "expr.foundation.module02.10"
      ],
      "lexeme_files": [
        "res://data/professional/lexemes/foundation-module02.json"
      ],
      "expression_files": [
        "res://data/professional/expressions/foundation-module02.json"
      ]
    },
    {
      "id": "module03",
      "title": "Warehouse places, equipment, and storage",
      "requirements_revision": "professional-v2-foundation02-held-six-r01",
      "status": "draft",
      "foundation": false,
      "vocabulary_target": 50,
      "expression_target": 10,
      "objectives": [
        "Understand and discuss warehouse places, equipment, and storage, checking current information and assigned responsibilities."
      ],
      "lexeme_ids": [
        "loading-bay.goods-transfer.n",
        "stockroom.goods-storage.n",
        "aisle.passage.n",
        "shelf.storage-surface.n",
        "pallet-jack.moving-equipment.n",
        "hand-truck.moving-frame.n",
        "conveyor-belt.moving-surface.n",
        "barcode-scanner.product-reader.n",
        "scanner.document-device.n",
        "label-printer.label-device.n",
        "weighing-scale.measurement-device.n",
        "workstation.computer-setup.n",
        "desktop-computer.desk-computer.n",
        "monitor.computer-display.n",
        "keyboard.computer-input.n",
        "printer.document-device.n",
        "tablet.portable-computer.n",
        "headset.audio-device.n",
        "charging-cable.power-cable.n",
        "ramp.sloping-route-between-levels.n",
        "warehouse.building-for-storing-goods.n",
        "forklift.powered-vehicle-with-load-lifting-forks.n",
        "reach-truck.industrial-truck-with-extending-fork-carriage.n",
        "handheld-terminal.portable-device-for-work-data-entry.n",
        "loading-dock.platform-for-vehicle-loading-and-unloading.n",
        "dock-leveler.adjustable-bridge-between-dock-and-vehicle.n",
        "dock-plate.portable-bridge-for-specified-dock-gap.n",
        "dock-door.door-at-loading-dock-opening.n",
        "dock-seal.flexible-seal-around-docked-vehicle.n",
        "picking-cart.wheeled-cart-for-order-picking.n",
        "roll-cage.wheeled-goods-container-with-cage-sides.n",
        "tote.reusable-container-for-moving-small-goods.n",
        "storage-bin.container-or-compartment-for-stored-items.n",
        "pallet-rack.storage-framework-for-palletized-goods.n",
        "rack-beam.horizontal-load-supporting-rack-member.n",
        "rack-upright.vertical-supporting-rack-member.n",
        "rack-guard.protective-barrier-for-rack-components.n",
        "charging-station.designated-place-for-battery-charging.n",
        "wrapping-machine.machine-for-applying-packaging-wrap.n",
        "strapping-machine.machine-for-applying-package-bands.n",
        "packing-bench.work-surface-for-order-packing.n",
        "pallet-scale.scale-designed-for-palletized-loads.n",
        "label-dispenser.device-presenting-labels-for-use.n",
        "tape-dispenser.device-holding-and-presenting-adhesive-tape.n",
        "receiving-area.designated-place-for-incoming-goods.n",
        "dispatch-area.designated-place-for-outgoing-goods.n",
        "staging-area.temporary-holding-area-between-work-stages.n",
        "returns-area.designated-place-for-returned-goods.n",
        "mezzanine.intermediate-floor-within-building.n",
        "pedestrian-walkway.route-designated-for-people-on-foot.n"
      ],
      "expression_ids": [
        "expr.warehouse_logistics.module03.01",
        "expr.warehouse_logistics.module03.02",
        "expr.warehouse_logistics.module03.03",
        "expr.warehouse_logistics.module03.04",
        "expr.warehouse_logistics.module03.05",
        "expr.warehouse_logistics.module03.06",
        "expr.warehouse_logistics.module03.07",
        "expr.warehouse_logistics.module03.08",
        "expr.warehouse_logistics.module03.09",
        "expr.warehouse_logistics.module03.10"
      ],
      "lexeme_files": [
        "res://data/professional/lexemes/retail-pilot.json",
        "res://data/professional/lexemes/software-data-pilot.json",
        "res://data/professional/lexemes/shared-pilot.json",